{
  "schema_id": "peepshow.target_profile",
  "schema_version": 1,
  "profile_id": "hw6_fw0_development",
  "profile_version": 4,
  "profile_status": "pending_validation",
  "package": {
    "maximum_bytes": 5242880,
    "resident_prefix_bytes": 65536
  },
  "state_scene_events": {
    "binding_count_max": 16,
    "queue_depth": 8,
    "sources": [
      {
        "event_type": "time.scene_elapsed",
        "status": "available_pending_validation",
        "required_capability": "time.delayed_event",
        "stop2_wake": true,
        "configuration_schema": {
          "delay_ms": {
            "type": "integer",
            "minimum": 10,
            "maximum": 86400000
          },
          "start_policy": {
            "type": "string",
            "enum": ["scene_entry", "action"],
            "default": "scene_entry"
          }
        }
      },
      {
        "event_type": "time.state_entry_elapsed",
        "status": "available_pending_validation",
        "required_capability": "time.delayed_event",
        "stop2_wake": true,
        "configuration_schema": {
          "delay_ms": {
            "type": "integer",
            "minimum": 10,
            "maximum": 86400000
          }
        }
      },
      {
        "event_type": "lifecycle.device_active",
        "status": "contracted_not_exposed",
        "required_capability": "logic.lifecycle_events",
        "stop2_wake": false,
        "configuration_schema": {}
      },
      {
        "event_type": "lifecycle.device_inactive",
        "status": "contracted_not_exposed",
        "required_capability": "logic.lifecycle_events",
        "stop2_wake": false,
        "configuration_schema": {}
      },
      {
        "event_type": "lifecycle.resume",
        "status": "contracted_not_exposed",
        "required_capability": "time.wake_reason",
        "stop2_wake": false,
        "configuration_schema": {}
      },
      {
        "event_type": "time.local_schedule",
        "status": "available_pending_validation",
        "required_capability": "time.calendar_schedule",
        "stop2_wake": true,
        "configuration_schema": {
          "mode": {"type": "enum", "values": ["daily", "today_offset", "next_occurrence"]},
          "time_of_day_seconds": {"type": "integer", "minimum": 0, "maximum": 86399},
          "day_offset": {"type": "integer", "minimum": 0, "maximum": 32767}
        }
      },
      {
        "event_type": "timeline.animation_complete",
        "status": "contracted_not_exposed",
        "required_capability": "render.waiting_visual_sequence",
        "stop2_wake": false,
        "configuration_schema": {}
      },
      {
        "event_type": "timeline.audio_marker",
        "status": "contracted_not_exposed",
        "required_capability": "audio.timeline",
        "stop2_wake": false,
        "configuration_schema": {}
      },
      {
        "event_type": "sensor.steps_milestone",
        "status": "contracted_not_exposed",
        "required_capability": "sensor.imu_steps",
        "stop2_wake": true,
        "configuration_schema": {
          "step_count": {
            "type": "integer",
            "minimum": 1,
            "maximum": 4294967295
          }
        }
      },
      {
        "event_type": "device.battery.soc_threshold",
        "status": "contracted_not_exposed",
        "required_capability": "power.battery_soc",
        "stop2_wake": false,
        "configuration_schema": {
          "threshold_percent": {
            "type": "integer",
            "minimum": 0,
            "maximum": 100
          },
          "direction": {
            "type": "enum",
            "values": [
              "falls_below",
              "rises_above"
            ]
          }
        }
      },
      {
        "event_type": "peripheral.generic",
        "status": "blocked",
        "required_capability": null,
        "stop2_wake": false,
        "configuration_schema": {}
      }
    ],
    "values": [
      {
        "value_type": "device.battery.soc_percent",
        "status": "contracted_not_exposed",
        "required_capability": "power.battery_soc",
        "data_type": "uint8",
        "minimum": 0,
        "maximum": 100
      },
      {
        "value_type": "device.battery.soc_valid",
        "status": "contracted_not_exposed",
        "required_capability": "power.battery_soc",
        "data_type": "boolean",
        "minimum": 0,
        "maximum": 1
      }
    ]
  },
  "audio": {
    "sampled_sfx": {
      "target_playback_status": "available_package_streamed_state_sfx",
      "compiled_format": "ima_adpcm_4bit",
      "sample_rate_hz": 16000,
      "channels": 1,
      "block_samples": 256,
      "maximum_duration_ms": null,
      "maximum_assets": 32,
      "maximum_cues": 64,
      "maximum_bank_bytes": 4194304,
      "voice_limit": 5,
      "package_window_bytes": 4096,
      "package_window_count": 2,
      "route_action": "play_sfx",
      "survives_same_package_scene_replacement": true,
      "unsupported": [
        "looping",
        "music",
        "procedural_audio"
      ]
    }
  }
}
